{
  "$schema": "./scripts/project.meta.schema.json",
  "schemaVersion": 1,
  "generatedAt": "2026-10-28T19:38:20.694Z",
  "generatedBy": "scripts/generate-project-meta.mjs",
  "identity": {
    "slug": "memory-dungeon",
    "repoName": "memory-dungeon",
    "packageName": "memory-dungeon",
    "version": "1.0.0",
    "title": "Memory Dungeon",
    "subtitle": "Seeker of Shards: a memory roguelite",
    "description": "A memory roguelite: read the board, match the pairs and protect the streak while relics bend the rules and every run deals deeper, harder boards. Run modes, a collection to unlock, local saves and an Electron build aimed at Steam.",
    "tags": [
      "Roguelite",
      "Memory Game",
      "React",
      "Electron",
      "Steam"
    ],
    "accent": "#f59e0b",
    "classification": "web-app",
    "showcaseTier": "showcase",
    "showcaseOrder": 2
  },
  "links": {
    "deploymentUrl": "https://memory-dungeon-git.pages.dev/",
    "localUrl": "http://127.0.0.1:4102/",
    "repository": "https://github.com/BorisThoris/memory-dungeon"
  },
  "runtime": {
    "packageManager": "yarn",
    "nodeEngine": ">=22.9.0",
    "buildCommand": "yarn build:cloudflare",
    "buildOutput": "dist",
    "runCommand": "yarn dev:renderer --host 127.0.0.1 --port 4102",
    "devPort": 4102,
    "scripts": [
      "dev",
      "dev:renderer",
      "demo:browser",
      "portfolio:smoke",
      "dev:electron:watch",
      "dev:electron",
      "build",
      "build:cloudflare",
      "build:renderer",
      "deploy:pages",
      "deploy:pages:test",
      "build:renderer:sourcemap",
      "analyze:bundle",
      "build:renderer:locked-dist",
      "build:renderer:alt-out",
      "build:electron",
      "build:electron:sourcemap",
      "clean",
      "typecheck",
      "typecheck:shared",
      "typecheck:e2e",
      "graph:project",
      "graph:systems",
      "ai:model",
      "ai:model:check",
      "ai:model:query",
      "sim:gameplay-core",
      "blueprint:codegen",
      "lint",
      "verify",
      "ci",
      "depcheck",
      "knip",
      "audit:unused-exports",
      "knip:exports",
      "knip:production",
      "gate:package-hygiene",
      "audit:bundle",
      "audit:renderer-assets",
      "audit:summary",
      "fullcheck",
      "gate:action-loop",
      "gate:gameplay-core",
      "gate:rewards-economy",
      "gate:navigation",
      "gate:systems",
      "gate:security",
      "gate:build-output",
      "gate:desktop-build",
      "gate:changed",
      "gate:sim-health",
      "gate:sim-softlock-seeds",
      "gate:sim-softlock-stress",
      "gate:softlock-full",
      "gate:persistence",
      "gate:renderer-input",
      "gate:audio-feedback",
      "gate:asset-rendering",
      "gate:gameplay",
      "gate:long-run",
      "gate:readability-long-run",
      "gate:long-run-ui-feedback",
      "sim:endless",
      "sim:cascade",
      "sim:pop",
      "sim:occupancy",
      "test",
      "test:gameplay:properties",
      "test:gameplay:properties:long",
      "test:watch",
      "test:e2e",
      "test:e2e:demo-readiness",
      "test:e2e:blueprint",
      "test:e2e:hall",
      "test:e2e:playtest",
      "test:e2e:illustration-regression",
      "test:e2e:a11y",
      "audit:copy-locality",
      "audit:bridge-reachability",
      "audit:built-csp",
      "audit:e2e-surfaces",
      "audit:e2e-locators",
      "audit:gate-reachability",
      "gate:balance-depth",
      "audit:store-reachability",
      "audit:css-custom-properties",
      "audit:css-duplicate-rules",
      "audit:min-type-size",
      "gate:demo-readiness",
      "gate:ui-reachability",
      "gate:ui-fit",
      "gate:illustration-regression",
      "gate:controller",
      "audit:save-field-policy",
      "audit:script-paths",
      "audit:generations",
      "audit:mutator-effects",
      "sim:run",
      "soak",
      "sim:curve",
      "sim:survival",
      "sim:goldilocks",
      "sim:memory-survival",
      "sim:deep-census",
      "sim:pop-share",
      "gate:pop-by-act",
      "gate:warden-reach",
      "gate:goldilocks",
      "gate:deep-census",
      "sim:archetype-pressure",
      "audit:shared-reach",
      "audit:test-only-modules",
      "steam:cloud-config",
      "steam:partner-config",
      "test:e2e:startup",
      "test:e2e:ui-fit",
      "test:e2e:ui-scale",
      "test:e2e:cascade",
      "test:e2e:deck-controller",
      "test:e2e:controller",
      "test:e2e:visual",
      "test:e2e:visual:device-grid",
      "test:e2e:visual:device-grid:shard1",
      "test:e2e:visual:device-grid:shard2",
      "test:e2e:visual:device-grid:shard3",
      "test:e2e:visual:device-grid:shard4",
      "test:e2e:visual:smoke",
      "test:e2e:visual:smoke:shard1",
      "test:e2e:visual:smoke:shard2",
      "test:e2e:visual:smoke:shard3",
      "test:e2e:mobile-layout",
      "test:e2e:playable-path:audit",
      "test:e2e:playable-path:readability",
      "test:e2e:board-3d-value",
      "test:e2e:browser-smoke",
      "test:e2e:browser-smoke:full",
      "test:e2e:browser-smoke:core",
      "test:e2e:browser-smoke:routes",
      "test:e2e:playable-path:full",
      "test:e2e:renderer-qa",
      "test:e2e:renderer-qa:full",
      "test:e2e:renderer-qa:layout",
      "test:e2e:renderer-qa:navigation",
      "test:e2e:renderer-qa:interludes",
      "test:e2e:renderer-qa:3d",
      "capture:ui-audit",
      "capture:visual-inventory",
      "capture:ui-design-reference",
      "capture:endproduct-parity",
      "capture:matched-flame",
      "capture:gameplay-audit",
      "benchmark:illustration-regression",
      "docs:ui-audit",
      "docs:visual-inventory",
      "docs:mechanics-appendix",
      "docs:system-diagrams",
      "gate:module-graph",
      "docs:release-checklist",
      "docs:release-checklist:check",
      "release:checklist",
      "docs:system-diagrams:check",
      "assets:choose-path-bg",
      "assets:ui-backgrounds:export-runtime-webp",
      "wip:extract-endproduct",
      "wip:extract-endproduct:react",
      "wip:extract-endproduct:png-only",
      "imagegen",
      "reel",
      "card-backs:local",
      "card-backs:local:dry",
      "face-panels:local",
      "face-panels:local:dry",
      "ui-art:local",
      "ui-art:local:dry",
      "ui-art:install",
      "face-panels:local:zimage",
      "face-panels:local:zimage:dry",
      "face-panels:install:zimage",
      "face-panels:manifest:zimage",
      "face-panels:export-runtime-webp",
      "card-normals:export-runtime-webp",
      "audio:ace-step:batch",
      "audio:ace-step:batch:dry",
      "audio:ace-step:smoke",
      "audio:ace-step:hybrid",
      "audio:ace-step:hybrid:dry",
      "audio:ace-step:app",
      "audio:ace-step:app:wav",
      "audio:ace-step:app:high",
      "audio:ace-step:app:max",
      "audio:ace-step:app:hq-variants",
      "audio:ace-step:app:max-variants",
      "audio:ace-step:app:variants",
      "audio:ace-step:app:xl",
      "audio:ace-step:ambience",
      "audio:ace-step:run-bed",
      "audio:ace-step:run-bed:library",
      "audio:ace-step:realm",
      "audio:ace-step:app:dry",
      "audio:install:ace-app-outputs",
      "audio:placeholders",
      "audio:export-runtime-ogg",
      "audio:materialize-references",
      "audio:materialize-references-from-pack",
      "audio:apply-reference-coverage",
      "audio:prep-ace-app",
      "gen:face-panel-raster-urls",
      "card-texture:ideal",
      "card-texture:ai-brief",
      "capture:ui-vs-assets",
      "png:trim-bbox",
      "optimize:card-front",
      "generate:card-plates",
      "build:card-illustration-manifest",
      "regenerate:illustration-regression",
      "bake:procedural-set",
      "test:e2e:ui",
      "package:dir",
      "package:win",
      "package:win:demo",
      "postinstall",
      "gate:difficulty-curve",
      "gate:difficulty-curve-endless",
      "gate:archetype-pressure",
      "gate:run-occupancy",
      "gate:occupancy",
      "audit:mechanic-accountability",
      "audit:test-only-exports",
      "audit:accessibility",
      "audit:music-key",
      "audit:health-claims",
      "meta",
      "meta:check",
      "shots",
      "social",
      "social:check",
      "icons",
      "icons:check",
      "meta:refresh",
      "trailers",
      "trailers:check",
      "test:media",
      "test:media:e2e"
    ]
  },
  "capture": {
    "route": "/",
    "actions": [
      {
        "type": "click",
        "target": {
          "role": "button",
          "name": "Continue to game",
          "exact": true
        },
        "timeoutMs": 10000,
        "optional": true,
        "label": "leave the studio splash"
      },
      {
        "type": "waitFor",
        "target": {
          "role": "button",
          "name": "Play",
          "exact": true
        },
        "timeoutMs": 45000,
        "label": "wait for the game menu"
      },
      {
        "type": "wait",
        "ms": 1500,
        "label": "let the title screen settle"
      }
    ],
    "waitAfterReadyMs": 2200
  },
  "media": {
    "source": "repo-local",
    "directory": "/root/gha/runners/memory-dungeon/_work/memory-dungeon/memory-dungeon/project-media",
    "primary": "project-media/card.jpg",
    "images": [
      {
        "profile": "card",
        "file": "card.jpg",
        "path": "project-media/card.jpg",
        "bytes": 88687,
        "width": 1600,
        "height": 900,
        "capturedAt": "2026-10-28T19:36:55.368Z"
      },
      {
        "profile": "desktop",
        "file": "desktop.jpg",
        "path": "project-media/desktop.jpg",
        "bytes": 82700,
        "width": 1440,
        "height": 900,
        "capturedAt": "2026-10-28T19:37:16.440Z"
      },
      {
        "profile": "full",
        "file": "full.jpg",
        "path": "project-media/full.jpg",
        "bytes": 71605,
        "width": 1440,
        "height": 900,
        "capturedAt": "2026-10-28T19:37:57.944Z"
      },
      {
        "profile": "mobile",